{
    "$schema": "http://json-schema.org/draft-07/schema#",
    "title": "Awards",
    "description": "content/data/awards.json: awards shown in the Awards section and the full CV. Array of entries.",
    "type": "array",
    "items": {
        "type": "object",
        "required": [
            "title",
            "awarder",
            "date"
        ],
        "properties": {
            "title": {
                "type": "string",
                "description": "Award name."
            },
            "awarder": {
                "type": "string",
                "description": "Who gave it. Required by the resume generator."
            },
            "date": {
                "type": "string",
                "description": "When, as text (e.g. \"2025\", \"Fall 2024\"). Required by the resume generator; identical title+awarder pairs are merged into one CV line."
            },
            "link": {
                "type": "string",
                "description": "Optional URL; makes the awarder a link."
            },
            "badge": {
                "type": "string",
                "description": "Highlight badge next to the title, e.g. \"Best Paper\"."
            },
            "spotlight": {
                "description": "Legacy form of badge: true shows \"Spotlight\", a string shows that text.",
                "anyOf": [
                    {
                        "type": "boolean"
                    },
                    {
                        "type": "string"
                    }
                ]
            },
            "description": {
                "type": "string",
                "description": "Extra detail, used in llms.txt."
            },
            "show_on_website": {
                "type": "boolean",
                "description": "Set to false to hide the award on the website.",
                "default": true
            },
            "show_in_resume": {
                "type": "boolean",
                "description": "Include in the full CV.",
                "default": true
            },
            "show_in_resume_short": {
                "type": "boolean",
                "description": "Not read: the short resume has no awards section."
            }
        }
    }
}
